{"$schema":"https://json-schema.org/draft/2020-12/schema","$id":"https://mindclade.dev/schemas/training-recipe/v1","title":"TrainingRecipe","type":"object","additionalProperties":false,"required":["schema_version","kind","metadata","spec","lineage","integrity"],"properties":{"schema_version":{"const":"mindclade.training-recipe/v1"},"kind":{"const":"TrainingRecipe"},"metadata":{"$ref":"#/$defs/metadata"},"spec":{"type":"object","additionalProperties":false,"required":["training_dataset","feature_plan","phase_graph","hyperparameters","random_seed","precision","intended_use"],"properties":{"training_dataset":{"$ref":"#/$defs/artifact_ref"},"feature_plan":{"$ref":"#/$defs/artifact_ref"},"phase_graph":{"$ref":"#/$defs/artifact_ref"},"hyperparameters":{"type":"object","minProperties":1,"maxProperties":128,"propertyNames":{"pattern":"^(?!.*(?:secret|token|password|credential))[a-z][a-z0-9_]{0,63}$"},"additionalProperties":{"oneOf":[{"type":"string","pattern":"^(?!.*\\$\\{).+$","maxLength":256},{"type":"number"},{"type":"boolean"}]}},"random_seed":{"type":"integer","minimum":0,"maximum":2147483647},"precision":{"enum":["FP32","BF16","FP16"]},"intended_use":{"const":"NON_CLINICAL_RESEARCH"}}},"lineage":{"type":"array","minItems":3,"maxItems":64,"items":{"$ref":"#/$defs/artifact_ref"}},"integrity":{"$ref":"#/$defs/integrity"}},"$defs":{"digest":{"type":"string","pattern":"^sha256:[a-f0-9]{64}$"},"metadata":{"type":"object","additionalProperties":false,"required":["uid","created_at","producer","classification"],"properties":{"uid":{"type":"string","minLength":1,"maxLength":128},"created_at":{"type":"string","format":"date-time"},"producer":{"type":"string","minLength":1,"maxLength":128},"classification":{"enum":["PUBLIC","INTERNAL","RESTRICTED"]}}},"artifact_ref":{"type":"object","additionalProperties":false,"required":["uri","digest","media_type","schema_version"],"properties":{"uri":{"type":"string","pattern":"^artifacts/[A-Za-z0-9._~/-]+$"},"digest":{"$ref":"#/$defs/digest"},"media_type":{"type":"string","minLength":1,"maxLength":128},"schema_version":{"type":"string","minLength":1,"maxLength":128}}},"integrity":{"type":"object","additionalProperties":false,"required":["payload_digest"],"properties":{"payload_digest":{"$ref":"#/$defs/digest"},"evidence":{"type":"array","maxItems":32,"items":{"$ref":"#/$defs/artifact_ref"}}}}}}
