{"schema_version":"mindclade.training-recipe/v1","kind":"TrainingRecipe","metadata":{"uid":"recipe-001","created_at":"2026-08-31T12:00:00Z","producer":"training-platform","classification":"INTERNAL"},"spec":{"training_dataset":{"uri":"artifacts/training-datasets/001","digest":"sha256:aaaaaaaaaaaaaaaaaaaaaaaaaaaaaaaaaaaaaaaaaaaaaaaaaaaaaaaaaaaaaaaa","media_type":"application/schema+json","schema_version":"mindclade.training-dataset-manifest/v1"},"feature_plan":{"uri":"artifacts/feature-plans/001","digest":"sha256:bbbbbbbbbbbbbbbbbbbbbbbbbbbbbbbbbbbbbbbbbbbbbbbbbbbbbbbbbbbbbbbb","media_type":"application/schema+json","schema_version":"mindclade.feature-plan/v1"},"phase_graph":{"uri":"artifacts/training-phase-graphs/001","digest":"sha256:cccccccccccccccccccccccccccccccccccccccccccccccccccccccccccccccc","media_type":"application/schema+json","schema_version":"mindclade.training-phase-graph/v1"},"hyperparameters":{"learning_rate":0.0001,"batch_size":32,"optimizer":"adamw"},"random_seed":42,"precision":"BF16","intended_use":"NON_CLINICAL_RESEARCH"},"lineage":[{"uri":"artifacts/training-datasets/001","digest":"sha256:aaaaaaaaaaaaaaaaaaaaaaaaaaaaaaaaaaaaaaaaaaaaaaaaaaaaaaaaaaaaaaaa","media_type":"application/schema+json","schema_version":"mindclade.training-dataset-manifest/v1"},{"uri":"artifacts/feature-plans/001","digest":"sha256:bbbbbbbbbbbbbbbbbbbbbbbbbbbbbbbbbbbbbbbbbbbbbbbbbbbbbbbbbbbbbbbb","media_type":"application/schema+json","schema_version":"mindclade.feature-plan/v1"},{"uri":"artifacts/training-phase-graphs/001","digest":"sha256:cccccccccccccccccccccccccccccccccccccccccccccccccccccccccccccccc","media_type":"application/schema+json","schema_version":"mindclade.training-phase-graph/v1"}],"integrity":{"payload_digest":"sha256:dddddddddddddddddddddddddddddddddddddddddddddddddddddddddddddddd","evidence":[]}}
